{
  "format": 1,
  "id": "openccu-loom",
  "name": "OpenCCU-Loom",
  "description": {
    "de": "Eigenständiger Go-Daemon: MQTT mit Home-Assistant-Discovery, REST- und WebSocket-API, MCP-Server, Matter-Bridge und eine Svelte-Konfigurationsoberfläche für ein oder mehrere Systeme. Noch nicht auf openccu-lite ausprobiert: Systemvariablen und Programme gibt es hier nicht; ob der Rest ohne ReGa läuft, ist offen.",
    "en": "Standalone Go daemon: MQTT with Home Assistant discovery, a REST and WebSocket API, an MCP server, a Matter bridge and a Svelte configuration UI for one or more systems. Not yet tried on openccu-lite: system variables and programs do not exist here; whether the rest runs without the ReGa is open."
  },
  "homepage": "https://sukramj.github.io/openccu-loom",
  "release": {
    "github": "SukramJ/openccu-loom",
    "asset": "openccu-loom-ccu-{version}.tar.gz"
  }
}
